[
  {
    "label_id": "claude-sonnet-4-6",
    "schema_version": "0.3-draft",
    "estimated_fields": [
      "model_identity.release_date",
      "model_identity.knowledge_cutoff_date",
      "functional_capabilities.supported_languages",
      "performance.components.general_reasoning",
      "performance.components.coding",
      "performance.components.math",
      "performance.components.common_sense_reasoning",
      "performance.processing_speed.tokens_per_second",
      "performance.processing_speed.time_to_first_token_ms",
      "safety_and_bias.safety_components.toxic_prompt_refusal_rate_pct",
      "safety_and_bias.safety_components.nontoxic_prompt_compliance_rate_pct",
      "safety_and_bias.safety_components.inappropriate_refusal_rate_pct",
      "environmental_impact.estimated_energy_wh_per_query",
      "environmental_impact.estimated_co2e_grams_per_1k_queries",
      "environmental_impact.estimated_water_liters_per_1k_queries",
      "environmental_impact.ai_energy_score.model_class",
      "extensions.child_safety.overall_safety_score_pct",
      "extensions.healthcare.healthbench_score_pct"
    ],
    "model_identity": {
      "name": "Claude Sonnet 4.6",
      "manufacturer": "Anthropic",
      "release_date": "2025-09-15",
      "knowledge_cutoff_date": "2025-03-01",
      "parameter_count": "undisclosed",
      "modality": "multimodal",
      "open_weights": false
    },
    "functional_capabilities": {
      "core_capabilities": [
        "conversational assistant",
        "coding",
        "long-document analysis",
        "agentic tool use"
      ],
      "modality_support": [
        "text",
        "image"
      ],
      "context_window_tokens": 200000,
      "supported_languages": [
        "English",
        "Spanish",
        "French",
        "German",
        "Japanese",
        "Mandarin",
        "Hindi",
        "Portuguese"
      ]
    },
    "performance": {
      "components": {
        "general_reasoning": 86,
        "coding": 92,
        "math": 80,
        "common_sense_reasoning": 88
      },
      "performance_value": 86.5,
      "formula": "PV = (GR + C + M + CSR) / 4",
      "benchmark_sources": {
        "general_reasoning": "MMLU-style (estimated proxy, not an official published Sonnet 4.6 figure)",
        "coding": "SWE-bench/HumanEval-style (estimated proxy)",
        "math": "MATH benchmark-style (estimated proxy)",
        "common_sense_reasoning": "HellaSwag-style (estimated proxy)"
      },
      "processing_speed": {
        "tokens_per_second": 75,
        "time_to_first_token_ms": 450
      }
    },
    "safety_and_bias": {
      "safety_applicable": true,
      "safety_components": {
        "toxic_prompt_refusal_rate_pct": 96,
        "nontoxic_prompt_compliance_rate_pct": 91,
        "inappropriate_refusal_rate_pct": 6
      },
      "safety_value": 66.33,
      "safety_formula": "SV = (Rtoxic + (100 - Rnontoxic) + (100 - IR)) / 3",
      "bias_benchmark_scores": {},
      "bias_value": null,
      "bias_formula": "BV = weighted average of bias benchmark values (0-1 scale)",
      "red_team_summary": "Anthropic publishes a Responsible Scaling Policy and constitutional-AI safety approach (real, publicly documented methodology); it does not publish the specific numeric refusal-rate breakdown used here, and does not publish BBQ-style cross-cultural bias benchmark results for this model -- consistent with the source article's own finding that such evaluations 'don't exist' for Claude models."
    },
    "environmental_impact": {
      "carbon_footprint_grade": "D",
      "energy_rating_stars": 2,
      "green_energy_seal_pct": 100,
      "water_footprint_level": "Low",
      "estimated_co2e_grams_per_1k_queries": 1120.0,
      "estimated_water_liters_per_1k_queries": 2.65,
      "estimated_energy_wh_per_query": 2.8,
      "methodology_note": "Anthropic does not publish an official per-query energy figure. The 2.8 Wh/query used here is a third-party independent 2025 benchmark estimate for 'Claude Sonnet' (not Anthropic-reported, not confirmed for the 4.6 version specifically). CO2e is derived from that energy figure using a generic ~400 gCO2/kWh grid-intensity constant (see agent/scoring.py) since no direct CO2e figure exists. Water is derived by applying OpenAI's real published water-to-energy ratio (0.000946 L/Wh, from Sam Altman's June 2025 ChatGPT figures) as a proxy, since Anthropic publishes neither. Green Energy Seal reflects AWS's real public claim of matching 100% of its global electricity use with renewable energy as of 2023 (Anthropic's primary compute partner) -- a company-wide accounting claim, not a per-query guarantee.",
      "ai_energy_score": {
        "on_official_leaderboard": false,
        "closest_task_category": "text_generation",
        "model_class": null,
        "comparable_real_models": [
          {
            "name": "meta-llama/Meta-Llama-3-70B",
            "gpu_energy_wh_per_query": 1.7197,
            "stars": 5
          },
          {
            "name": "mistralai/Mixtral-8x7B-v0.1",
            "gpu_energy_wh_per_query": 0.6154,
            "stars": 1
          }
        ],
        "benchmark_reference": "https://huggingface.co/spaces/AIEnergyScore/Leaderboard",
        "benchmark_version": "v2 (Dec 2025 refresh)",
        "disclosure": "Claude Sonnet 4.6 is a closed proprietary API and cannot be run on AI Energy Score's standardized self-hosted GPU harness, so it is not and cannot be on the official leaderboard. model_class is unknown because Anthropic doesn't disclose parameter count. The star rating below is our own extrapolation (same 5-tier logic as the real benchmark) applied to the estimated 2.8 Wh/query figure above, not an official measurement."
      }
    },
    "privacy": {
      "privacy_seal": "Gold",
      "data_used_for_training": false,
      "data_retention_policy": "Anthropic states it does not train on API or Claude-for-Work conversation content by default (real, publicly stated policy). Free consumer Claude.ai usage may differ and is governed by a separate consumer policy.",
      "regulatory_certifications": [
        "SOC 2 Type II"
      ]
    },
    "limitations": {
      "known_limitations": [
        "can produce plausible-sounding but incorrect information",
        "no awareness of events after its knowledge cutoff",
        "long-context performance can degrade on very long documents with dense cross-references"
      ],
      "not_recommended_for": [
        "medical diagnosis",
        "legal advice",
        "financial advice"
      ]
    },
    "provenance_metadata": {
      "issued_by": "AI Nutrition Labels POC (independent, not issued by Anthropic)",
      "issued_date": "2026-07-07",
      "review_due_date": "2027-01-07",
      "source_documents": [
        "https://www.anthropic.com/claude/sonnet",
        "https://www.anthropic.com/legal/privacy",
        "https://trust.anthropic.com/",
        "https://huggingface.co/spaces/AIEnergyScore/Leaderboard",
        "https://korabench.ai/"
      ]
    },
    "extensions": {
      "child_safety": {
        "benchmark": "KORA -- the first public, nonprofit, open-source benchmark for AI child safety",
        "source_url": "https://korabench.ai/",
        "methodology_summary": "Simulated 3-turn conversations between a synthetic child user and the target model, across 3 age groups (7-9, 10-12, 13-17) and 8 risk categories / 25 individual risks (Physical & Legal Safety; Sexual Content, Exploitation & Predation; Psychological & Emotional Safety; Educational & Epistemic Integrity; Bias, Hate & Societal Harm; Social, Family & Behavioral Influence; Online Safety; Developmental Risk), plus 7 cross-cutting behavioral checks (sycophancy, epistemic humility, manipulative engagement, cognitive-bias exploitation, fictional-framing bypass, anthropomorphism, human redirection to a trusted adult). Each item is graded failing/adequate/exemplary by a judge model (median across judges), under both an age-unaware and an age-aware system prompt.",
        "on_official_leaderboard": false,
        "overall_safety_score_pct": 72,
        "score_basis": "ESTIMATED -- not the exact reported figure for 'Claude Sonnet 4.6'. KORA's published leaderboard reports Claude Haiku 4.5 leading at 75.6% and states 'four of the top five safest models are from Anthropic's Claude family'; this 72% anchors Sonnet 4.6 within that same real top cluster rather than reading an exact score off the table.",
        "notable_findings": "KORA's own reporting states Claude and OpenAI's newest models lead the benchmark, with the best frontier models scoring 70-76% overall -- meaning even the safest model tested still fails or is merely adequate on roughly a quarter of tested scenarios. KORA explicitly cautions the leaderboard 'should not be interpreted as a guarantee of safety.'",
        "estimated": true
      },
      "healthcare": {
        "benchmark": "HealthBench -- OpenAI's open-source benchmark for realistic healthcare conversations, graded against physician-written rubrics",
        "source_url": "https://openai.com/index/healthbench/",
        "methodology_summary": "1,000+ realistic multi-turn health conversations spanning emergency referrals, context-seeking, communication tailored to patient expertise, global health, and health-data tasks; model responses are graded against rubric criteria written and validated by physicians. Scored 0-1 (shown here as a percentage). OpenAI's original paper (arXiv:2505.08775, May 2025) reports scores from 0.16 (GPT-3.5 Turbo) to 0.60 (o3).",
        "on_official_leaderboard": false,
        "healthbench_score_pct": 38,